<?xml version="1.0" encoding="UTF-8"?>
<PermaStoreConfigurations xmlns:xsi="http://www.w3.org/2001/XMLSchema-instance"
	xsi:noNamespaceSchemaLocation="permastoreconfig.xsd">
	<!-- Test Custom PermaStoreBuilder -->
	<PermaStoreConfiguration>
		<Name>GetStagingAreas</Name>
		<isEnabled>true</isEnabled>
		<featureInfo featureName="feature1" featureGroup="featuregroup1"/>
		<DataType>List</DataType>
		<ConfigurationBuilder type="CUSTOM">
			<CustomBuilder>
				<builder>com.attunedlabs.permastore.config.StageingAreaListBuilder</builder>
			</CustomBuilder>
		</ConfigurationBuilder>
		<PublishPermaStoreEvent>
			<OnConfigDelete>AreaListDeletedEvent</OnConfigDelete>
			<OnConfigStatusChange>AreaListStatusChangedEvent</OnConfigStatusChange>
			<OnConfigEntryDelete>AreaDeletedEvent</OnConfigEntryDelete>
			<OnConfigEntryAdd>AreaAddedEvent</OnConfigEntryAdd>
			<OnConfigEntryUpdate>AreaUpdatedEvent</OnConfigEntryUpdate>
		</PublishPermaStoreEvent>
		<SubscribePermaStoreEvents> 
			<PermaStoreEvent onEvent="reload">
			     <EventName>xyz</EventName>
			     <PermaStoreEventHandler>com.attunedlabs.inventory.HandlePicAddressAddition</PermaStoreEventHandler>
			</PermaStoreEvent>
		</SubscribePermaStoreEvents>
	</PermaStoreConfiguration>
	<!-- Test INLINE JSON-MAP builder -->
	<PermaStoreConfiguration>
        <Name>loadnum</Name>
        <isEnabled>true</isEnabled>
        
        <featureInfo featureName="feature1" featureGroup="featuregroup1"/>
        <DataType>Map</DataType>
        <ConfigurationBuilder type="INLINE">
            <InlineBuilder type="JSON-TO-Map">
                {"variable" :"lodnum","locale_id":"US_ENGLISH"}
            </InlineBuilder>
        </ConfigurationBuilder>
        <PublishPermaStoreEvent>
            <OnConfigDelete></OnConfigDelete>
            <OnConfigStatusChange></OnConfigStatusChange>
            <OnConfigEntryDelete></OnConfigEntryDelete>
            <OnConfigEntryAdd></OnConfigEntryAdd>
            <OnConfigEntryUpdate></OnConfigEntryUpdate>
        </PublishPermaStoreEvent>
        <SubscribePermaStoreEvents>
            <PermaStoreEvent onEvent="reload">
            <EventName>TerminologyChange</EventName>
                 <PermaStoreEventHandler>com.attunedlabs.inventory.HandlePicAddressAddition</PermaStoreEventHandler>
            </PermaStoreEvent>
        </SubscribePermaStoreEvents>
    </PermaStoreConfiguration>
  	<PermaStoreConfiguration>
		<Name>GetStagingAreasOne</Name>
		<isEnabled>true</isEnabled>
		<featureInfo featureName="feature1" featureGroup="featuregroup1"/>
		<DataType>List</DataType>
		<ConfigurationBuilder type="CUSTOM">
			<CustomBuilder>
				<builder>com.attunedlabs.permastore.config.StageingAreaStringBuilder</builder>
			</CustomBuilder>
		</ConfigurationBuilder>
		<PublishPermaStoreEvent>
			<OnConfigDelete>AreaListDeletedEvent</OnConfigDelete>
			<OnConfigStatusChange>AreaListStatusChangedEvent</OnConfigStatusChange>
			<OnConfigEntryDelete>AreaDeletedEvent</OnConfigEntryDelete>
			<OnConfigEntryAdd>AreaAddedEvent</OnConfigEntryAdd>
			<OnConfigEntryUpdate>AreaUpdatedEvent</OnConfigEntryUpdate>
		</PublishPermaStoreEvent>
		<SubscribePermaStoreEvents> 
			<PermaStoreEvent onEvent="reload">
			     <EventName>xyz</EventName>
			     <PermaStoreEventHandler>com.attunedlabs.inventory.HandlePicAddressAddition</PermaStoreEventHandler>
			</PermaStoreEvent>
		</SubscribePermaStoreEvents>
	</PermaStoreConfiguration>
	
</PermaStoreConfigurations>
