<?xml version="1.0" encoding="UTF-8"?>
<PermaStoreConfigurations xmlns:xsi="http://www.w3.org/2001/XMLSchema-instance"
	xsi:noNamespaceSchemaLocation="permastoreconfig.xsd">
	<PermaStoreConfiguration>
		<!--  <Name>AreaList</Name>-->
		<featureInfo featureName="" featureGroup=""/>
		<DataType>List</DataType>
		<ConfigurationBuilder>
			<CustomBuilder>
				<builder>com.getusroi.configBuilder.PICAdressBuilder</builder>
			</CustomBuilder>
		</ConfigurationBuilder>
		<PublishPermaStoreEvent>
			<OnConfigDelete>AreaListDeletedEvent</OnConfigDelete>
			<OnConfigStatusChange>AreaListStatusChangedEvent</OnConfigStatusChange>
			<OnConfigEntryDelete>AreaDeletedEvent</OnConfigEntryDelete>
			<OnConfigEntryAdd>AreaAddedEvent</OnConfigEntryAdd>
			<OnConfigEntryUpdate>AreaUpdatedEvent</OnConfigEntryUpdate>
		</PublishPermaStoreEvent>
		<SubscribePermaStoreEvents> 
			<PermaStoreEvent onEvent="reload">
			     <EventName>xyz</EventName>
			     <PermaStoreEventHandler>com.getusroi.inventory.HandlePicAddressAddition</PermaStoreEventHandler>
			</PermaStoreEvent>
		</SubscribePermaStoreEvents>
	</PermaStoreConfiguration>
	
	<PermaStoreConfiguration>
		<Name>PicAreaList</Name>
		<featureInfo featureGroup="fgf" featureName=""/>
		<DataType>List</DataType>
		<ConfigurationBuilder>
			<SQLBuilder>
				<SQLQuery mappedClass="com.getusroi.pic.Area">select * from table where areaType=?</SQLQuery>
			</SQLBuilder>
		</ConfigurationBuilder>
		<PublishPermaStoreEvent>
			<OnConfigDelete></OnConfigDelete>
			<OnConfigStatusChange></OnConfigStatusChange>
			<OnConfigEntryDelete></OnConfigEntryDelete>
			<OnConfigEntryAdd></OnConfigEntryAdd>
			<OnConfigEntryUpdate></OnConfigEntryUpdate>
		</PublishPermaStoreEvent>
		<SubscribePermaStoreEvents>
			<PermaStoreEvent onEvent="reload">
			<EventName>hhj</EventName>
			     <PermaStoreEventHandler>com.getusroi.inventory.HandlePicAddressAddition</PermaStoreEventHandler>
			</PermaStoreEvent>
		</SubscribePermaStoreEvents>
	</PermaStoreConfiguration>
</PermaStoreConfigurations>
