<?xml version="1.0" encoding="UTF-8"?>
<PermaStoreConfigurations xmlns:xsi="http://www.w3.org/2001/XMLSchema-instance"
	xsi:noNamespaceSchemaLocation="permastoreconfig.xsd">
	<PermaStoreConfiguration>
		<Name>AreaList</Name>
		<isEnabled>true</isEnabled>
		<featureInfo featureName="feature1" featureGroup="featuregroup1" />
		<DataType>List</DataType>
		<ConfigurationBuilder type="CUSTOM">
			<CustomBuilder>
				<builder>com.attunedlabs.permastore.config.PICAddressBuilder</builder>
			</CustomBuilder>
		</ConfigurationBuilder>
		<PublishPermaStoreEvent>
			<OnConfigDelete>AreaListDeletedEvent</OnConfigDelete>
			<OnConfigStatusChange>AreaListStatusChangedEvent
			</OnConfigStatusChange>
			<OnConfigEntryDelete>AreaDeletedEvent</OnConfigEntryDelete>
			<OnConfigEntryAdd>AreaAddedEvent</OnConfigEntryAdd>
			<OnConfigEntryUpdate>AreaUpdatedEvent</OnConfigEntryUpdate>
		</PublishPermaStoreEvent>
		<SubscribePermaStoreEvents>
			<PermaStoreEvent onEvent="reload">
				<EventName>xyz</EventName>
				<PermaStoreEventHandler>com.attunedlabs.inventory.HandlePicAddressAddition
				</PermaStoreEventHandler>
			</PermaStoreEvent>
		</SubscribePermaStoreEvents>
	</PermaStoreConfiguration>

	<!-- Test SQLBuilder with Custom Mapper-->
	<PermaStoreConfiguration>
		<Name>TestSQLBuilderCustomMapper</Name>
		<isEnabled>true</isEnabled>
		<featureInfo featureName="feature1" featureGroup="featuregroup1" />
		<DataType>List</DataType>
		<ConfigurationBuilder type="SQL">
			<SQLBuilder>
				<SQLQuery mappedClass="com.attunedlabs.permastore.config.StageAreaPSSQLResultsetMapper">select * from AreaList where AreaType='Stage'
				</SQLQuery>
			</SQLBuilder>
		</ConfigurationBuilder>
		<PublishPermaStoreEvent>
			<OnConfigDelete></OnConfigDelete>
			<OnConfigStatusChange></OnConfigStatusChange>
			<OnConfigEntryDelete></OnConfigEntryDelete>
			<OnConfigEntryAdd></OnConfigEntryAdd>
			<OnConfigEntryUpdate></OnConfigEntryUpdate>
		</PublishPermaStoreEvent>
		<SubscribePermaStoreEvents>
			<PermaStoreEvent onEvent="reload">
				<EventName>hhj</EventName>
				<PermaStoreEventHandler>com.attunedlabs.inventory.HandlePicAddressAddition
				</PermaStoreEventHandler>
			</PermaStoreEvent>
		</SubscribePermaStoreEvents>
	</PermaStoreConfiguration>
	<!-- Test SQLBuilder with List-OF-Map builder-->
	<PermaStoreConfiguration>
		<Name>TestSQLBuilderList-OF-MapMapper</Name>
		<isEnabled>true</isEnabled>
		<featureInfo featureName="feature1" featureGroup="featuregroup1" />
		<DataType>List</DataType>
		<ConfigurationBuilder type="SQL">
			<SQLBuilder>
				<SQLQuery mappedClass="List-Of-Map">select * from AreaList where AreaType='Stage'
			</SQLQuery>
			</SQLBuilder>
		</ConfigurationBuilder>
		<PublishPermaStoreEvent>
			<OnConfigDelete></OnConfigDelete>
			<OnConfigStatusChange></OnConfigStatusChange>
			<OnConfigEntryDelete></OnConfigEntryDelete>
			<OnConfigEntryAdd></OnConfigEntryAdd>
			<OnConfigEntryUpdate></OnConfigEntryUpdate>
		</PublishPermaStoreEvent>
		<SubscribePermaStoreEvents>
			<PermaStoreEvent onEvent="reload">
				<EventName>hhj</EventName>
				<PermaStoreEventHandler>com.attunedlabs.inventory.HandlePicAddressAddition
				</PermaStoreEventHandler>
			</PermaStoreEvent>
		</SubscribePermaStoreEvents>
	</PermaStoreConfiguration>
	
	<PermaStoreConfiguration>
		<Name>lodnum</Name>
		<isEnabled>true</isEnabled>

		<featureInfo featureName="feature1" featureGroup="featuregroup1" />
		<DataType>Map</DataType>
		<ConfigurationBuilder type="INLINE">
			<InlineBuilder type="JSON-TO-Map">
				{"variable" :"lodnum","locale_id":"US_ENGLISH"}
			</InlineBuilder>
		</ConfigurationBuilder>
		<PublishPermaStoreEvent>
			<OnConfigDelete></OnConfigDelete>
			<OnConfigStatusChange></OnConfigStatusChange>
			<OnConfigEntryDelete></OnConfigEntryDelete>
			<OnConfigEntryAdd></OnConfigEntryAdd>
			<OnConfigEntryUpdate></OnConfigEntryUpdate>
		</PublishPermaStoreEvent>
		<SubscribePermaStoreEvents>
			<PermaStoreEvent onEvent="reload">
				<EventName>TerminologyChange</EventName>
				<PermaStoreEventHandler>com.attunedlabs.inventory.HandlePicAddressAddition
				</PermaStoreEventHandler>
			</PermaStoreEvent>
		</SubscribePermaStoreEvents>
	</PermaStoreConfiguration>

	<PermaStoreConfiguration>
		<Name>AreaListSecond</Name>
		<isEnabled>false</isEnabled>
		<featureInfo featureName="feature1" featureGroup="featuregroup1" />
		<DataType>Map</DataType>
		<ConfigurationBuilder type="CUSTOM">
			<CustomBuilder>
				<builder>com.attunedlabs.permastore.config.PICAddressBuilder</builder>
			</CustomBuilder>
		</ConfigurationBuilder>
		<PublishPermaStoreEvent>
			<OnConfigDelete>AreaListDeletedEvent</OnConfigDelete>
			<OnConfigStatusChange>AreaListStatusChangedEvent
			</OnConfigStatusChange>
			<OnConfigEntryDelete>AreaDeletedEvent</OnConfigEntryDelete>
			<OnConfigEntryAdd>AreaAddedEvent</OnConfigEntryAdd>
			<OnConfigEntryUpdate>AreaUpdatedEvent</OnConfigEntryUpdate>
		</PublishPermaStoreEvent>
		<SubscribePermaStoreEvents>
			<PermaStoreEvent onEvent="reload">
				<EventName>xyz</EventName>
				<PermaStoreEventHandler>com.attunedlabs.inventory.HandlePicAddressAddition
				</PermaStoreEventHandler>
			</PermaStoreEvent>
		</SubscribePermaStoreEvents>
	</PermaStoreConfiguration>
	<PermaStoreConfiguration>
		<Name>AreaListThree</Name>
		<isEnabled>false</isEnabled>
		<featureInfo featureName="feature1" featureGroup="featuregroup1" />
		<DataType>Map</DataType>
		<ConfigurationBuilder type="CUSTOM">
			<CustomBuilder>
				<builder>com.attunedlabs.permastore.config.PICAddressBuilder</builder>
			</CustomBuilder>
		</ConfigurationBuilder>
		<PublishPermaStoreEvent>
			<OnConfigDelete>AreaListDeletedEvent</OnConfigDelete>
			<OnConfigStatusChange>AreaListStatusChangedEvent
			</OnConfigStatusChange>
			<OnConfigEntryDelete>AreaDeletedEvent</OnConfigEntryDelete>
			<OnConfigEntryAdd>AreaAddedEvent</OnConfigEntryAdd>
			<OnConfigEntryUpdate>AreaUpdatedEvent</OnConfigEntryUpdate>
		</PublishPermaStoreEvent>
		<SubscribePermaStoreEvents>
			<PermaStoreEvent onEvent="reload">
				<EventName>xyz</EventName>
				<PermaStoreEventHandler>com.attunedlabs.inventory.HandlePicAddressAddition
				</PermaStoreEventHandler>
			</PermaStoreEvent>
		</SubscribePermaStoreEvents>
	</PermaStoreConfiguration>

	<PermaStoreConfiguration>
		<Name>lodnumSecond</Name>
		<isEnabled>false</isEnabled>

		<featureInfo featureName="feature1" featureGroup="featuregroup1" />
		<DataType>Map</DataType>
		<ConfigurationBuilder type="INLINE">
			<InlineBuilder type="JSON-TO-Map">
				{"variable" :"lodnum","locale_id":"US_ENGLISH"}
			</InlineBuilder>
		</ConfigurationBuilder>
		<PublishPermaStoreEvent>
			<OnConfigDelete></OnConfigDelete>
			<OnConfigStatusChange></OnConfigStatusChange>
			<OnConfigEntryDelete></OnConfigEntryDelete>
			<OnConfigEntryAdd></OnConfigEntryAdd>
			<OnConfigEntryUpdate></OnConfigEntryUpdate>
		</PublishPermaStoreEvent>
		<SubscribePermaStoreEvents>
			<PermaStoreEvent onEvent="reload">
				<EventName>TerminologyChange</EventName>
				<PermaStoreEventHandler>com.attunedlabs.inventory.HandlePicAddressAddition
				</PermaStoreEventHandler>
			</PermaStoreEvent>
		</SubscribePermaStoreEvents>
	</PermaStoreConfiguration>
<!-- 	For Camel Route Builder
	<PermaStoreConfiguration>
		<Name>camelRoute</Name>
		<isEnabled>true</isEnabled>
		<featureInfo featureName="feature1" featureGroup="featuregroup1" />
		<DataType>JSON</DataType>
		<ConfigurationBuilder type="CAMEL-ROUTE">
			<CamelRouteBuilder>
				<routeName>loadAreaList</routeName>
			</CamelRouteBuilder>
		</ConfigurationBuilder>
		<PublishPermaStoreEvent>
			<OnConfigDelete></OnConfigDelete>
			<OnConfigStatusChange></OnConfigStatusChange>
			<OnConfigEntryDelete></OnConfigEntryDelete>
			<OnConfigEntryAdd></OnConfigEntryAdd>
			<OnConfigEntryUpdate></OnConfigEntryUpdate>
		</PublishPermaStoreEvent>
		<SubscribePermaStoreEvents>
			<PermaStoreEvent onEvent="reload">
				<EventName>TerminologyChange</EventName>
				<PermaStoreEventHandler>com.attunedlabs.inventory.HandlePicAddressAddition
				</PermaStoreEventHandler>
			</PermaStoreEvent>
		</SubscribePermaStoreEvents>
	</PermaStoreConfiguration>
 -->
</PermaStoreConfigurations>
